Overview,Website,Industry,Company size,Headquarters,Founded,Specialties,Phone
"Muthoot FinCorp Limited (MFL) is the flagship Company of the Muthoot Pappachan Group . MFL is Financial Services SuperHouse or you call it PowerHouse!

A market leader in the gold loans business Muthoot FinCorp has over 3,600 branches spread across the cities, towns and villages of India, the Company serves more than 75,000 customers a day.

Muthoot FinCorp’s long-standing experience,expertise and stronghold in the semi urban and rural areas has enabled the Company to provide quick, customized finance options and investment products, maximizing returns to the population. The loan products of Muthoot FinCorp are uniquely structured to serve people who do not have easy  access to mainstream commercial banks.

MFL counts the satisfaction and long-service of its people as a cornerstone of its success. Fostering teamwork, nurturing creativity and rewarding commitment are systematically and professionally managed. Excellence and innovation are encouraged and rewarded. Ensuring Muthoot FinCorp's people remain at the competitive edge, best practice in the area and unique motivational programs are regularly carried out.",http://www.muthootfincorp.com,Financial Services,"10,001+ employees 8,433 on LinkedIn
            
 



    Includes members with current employer listed as Muthoot Fincorp Ltd., including part-time roles.","Trivandrum, Kerala",1887,"Gold Loan, Auto Loan, Money Transfer, Foreign Exchange, Mutual Fund, Demat Services, MSME Loans, Travel Services, LoanviaSMS, and Best quality lowest cost jewellery",
"The World Bank Treasury has achieved a global reputation as a prudent and innovative borrower, investor and risk manager. Our vision is to be the trusted leader, global expert and continuous innovator - delivering impactful financial services with integrity and excellence.

Treasury contributes to the Twin Goals of the World Bank Group: (1) to end extreme poverty and (2) promote shared prosperity. We do this by ensuring the long-term financial sustainability of the World Bank (IBRD and IDA), using capital markets innovations to finance sustainable development, exceeding investment objectives, and serving clients through advisory and risk management products and services.

We manage the World Bank's finances to enable all operations and lending, act as a trusted advisor to our member countries to support financial stability and resilience, and lead financial innovation to implement the Maximizing Finance for Development agenda.",http://treasury.worldbank.org,Financial Services,"201-500 employees 167 on LinkedIn
            
 



    Includes members with current employer listed as The World Bank Treasury (IBRD • IDA), including part-time roles.","Washington, DC",1946,"Capital Markets, Capacity Building, Risk Management, Debt Management, Reserves Management, Financial Services, Bonds, Pension Administration, Banking, Financial Advisory, Quantitative Analysis, Strategic Asset Allocation, Asset Management, Derivatives, Financial Solutions, Development Finance, Fintech, and Financial Technology",
"Welcome to Niyo, India’s leading Fintech, aimed at making banking simpler, smarter and safer for over five million customers in India.
Since its inception in 2015, Niyo has been at the forefront of revolutionising banking with continual digital innovation.

Let’s just say – we help you save more, be more and do more. Take your banking experience a notch higher with: 

Niyo Global: An Indian passport holder's preferred bank account in partnership with SBM Bank (India). Designed to help you travel the world with zero forex markups, this account comes with a VISA Signature debit card that also gives you complimentary airport lounge access in India, savings account with upto 5% interest along with a host of travel features.  
NiyoX: A 2-in-1 account in partnership with Equitas Small Finance Bank, that takes care of both - your savings and investments. With zero commissions on mutual funds and upto 7% interest p.a on savings, this zero balance savings account helps you #DecodeBanking and keeps you worry free.

Come Onboard, to find out why some of our users say,
Niyo is the best thing to have happened to banking since banking.",http://www.goniyo.com,Financial Services,"501-1,000 employees 505 on LinkedIn
            
 



    Includes members with current employer listed as Niyo Solutions Inc., including part-time roles. Also includes employees from subsidiary: Index.","Bangalore, Karnatka",,,
"ADF, through its Personify Financial brand, is the trusted financial partner for tens of thousands of underestimated and under-banked Americans. Combining state-of-the-art technology and world-class application of advanced data science and machine learning, ADF is setting a new standard for assessing near-prime and non-prime borrower credit and fraud risk.",http://www.applieddatafinance.com,Financial Services,"201-500 employees 385 on LinkedIn
            
 



    Includes members with current employer listed as Applied Data Finance, including part-time roles.",,2014,"Consumer Lending, Installment Loans, and Unsecured Consumer Financing",
"We are a world-leading payment solution provider for merchants, international corporates and SME’s, and consumers. PagoNxt brings together the most disruptive payment businesses from Banco Santander. While part of Banco Santander, boasting over 160 years of banking experience and 153 million customers worldwide, PagoNxt is an autonomous company, working as a fintech to deliver fast solutions to the payments market. 

Headquartered in Madrid with a presence in 14 countries and a team of 3,300 payment experts and developers worldwide, with an extra 1,200 external developers, PagoNxt delivers its value proposition to more than 1.2 million merchants, 200,000 international SME’s and corporates worldwide, and over 700.000 consumers. 

PagoNxt comprises Getnet on our acquiring business, OneTrade, Payments Hub, Ebury, Mercury TFS on our trade business, and Superdigital for our consumer proposition.

We boost the future of payments to Now. To Wow!",,Financial Services,"1,001-5,000 employees 798 on LinkedIn
            
 



    Includes members with current employer listed as PagoNxt (a Santander company), including part-time roles.","Madrid, Madrid",2020,"Payments, Merchant Solutions, Trade Solutions, and Consumer Solutions",
"HDFC securities has been serving a diverse customer base of retail and institutional investors, since 2000.
Headquartered in Mumbai, it offers an exhaustive product suite to help its customers invest in Equities, IPO/OFS, Buybacks, Mutual Funds, ETFs, Futures & Options for - Equity, Currency and Commodities, Fixed Deposits, Bonds, NCDs and National Pension Scheme, along with value added services like Online Will writing and Tax filing. The company offers a host of digital platforms like Mobile Trading App, Desktop based online trading facility, ProTerminal- an advanced trading platform and Arya- a voice enabled investing assistant. It also offers Call N Trade facility and dedicated Relationship Managers to assist customers. 
Since its inception, the company has established itself as a preferred trading platform (for NSE & BSE), with its integrated 3-in-1 account (Trading + Demat + Savings) backed by state-of-the-art technology. Over the years, the company has won many awards and recognitions. It is been contributing in various CSR activities pertaining to education, water, sanitation, financial awareness and medical assistance. Currently, the company has 250+ branches across 190 cities, serving over 2.1 million customers.",http://www.hdfcsec.com/,Capital Markets,"1,001-5,000 employees 3,692 on LinkedIn
            
 



    Includes members with current employer listed as HDFC securities, including part-time roles.","Mumbai, Maharashtra",2000,,
"Angel One (formerly known as Angel Broking) is a Fintech firm driven by technology and on a mission to become the No. 1 fintech organization in India. With a  10 millions+ registered client base and more than 15 million app downloads, we are onboarding more than 400K new users every month.

We are working to build personalized financial journeys for customers via a single app, powered by new-age engineering tech and Machine Learning. We are a group of self-driven, motivated individuals who enjoy taking ownership and believe in providing best value for money to investors through innovative products and investment strategies. We apply and amplify design thinking with our products and solution.

It is a flat structure, with ample opportunity to showcase your talent and a growth path for engineers to the very top. We are remote-first, with people spread across Bangalore, Mumbai, UAE, and the US.

Come on Onboard 🤝, to become part of this epic journey!
We are aggressively hiring Engineers, Product Manager & Data science rockstars from across the globe - check out our career’s sections!

#BreakTheOffice #AngelOneForAll",http://www.angelone.in,Financial Services,"1,001-5,000 employees 8,208 on LinkedIn
            
 



    Includes members with current employer listed as Angel One, including part-time roles.","Mumbai, Maharashtra",1996,"Equity, Mutual Fund, Commodity, Derivatives, Research, Investments, Online Trading, Mobile Trading, ARQ, Currencies, and Insurance","022-33551111
            

              Phone number is 022-33551111"
"Tata Motors Finance (TMF) is committed to attracting, motivating and retaining individuals of the highest calibre and potential.

TMF in partnership with Tata Motors Limited, brings with it more than 58 years of captive financing expertise. Our product portfolio ranges across new asset financing for Passenger Cars, Utility Vehicles, Commercial Vehicles, Motor Insurance, Used Vehicle and Construction Equipment financing. TMF is currently the largest financer of vehicles manufactured by Tata Motors in India and poised to grow rapidly over the next few years.

Our Core Purpose is to reach out and help our customers realize the dream of owning a Tata vehicle easily.

We are driven by 5 Core Values  - Integrity, Excellence, Care & Concern, Creativity & Innovation, Commitment.

Our Vision is to be the most admired and successful vehicle finance company adhering to our core values. We shall achieve this by:
-          Excellence in all our operations
-          Use of cutting edge technology
-          Being the partner of choice

Thereby creating a great place to work !!!

Go the extra mile is the bedrock of an enabling culture at TMF as we strive for excellence, exceeding boundaries and setting new standards in all that we do. 

For career opportunities, visit our website...",http://tmf.co.in,Financial Services,"1,001-5,000 employees 3,238 on LinkedIn
            
 



    Includes members with current employer listed as Tata Motor Finance, including part-time roles.",,2008,"New Vehicle Finance, Used Vehicle Finance, Construction Equipment Finance, and Channel Finance","1800-209-0188
            

              Phone number is 1800-209-0188"
"Edelweiss Wealth Management is dedicated to building long term relationships with clients
and empowering them to gain from market opportunities.
Our approach is to understand the financial needs of customers and recommend investment
options in a super simple manner.
Our customers invest and trade in all major asset classes like Equity, Derivatives, Currencies, Mutual Funds, Gold ETFs, IPOs.
And we’re part of a Larger Family, The Edelweiss Group, which is one of India's leading diversified financial services company providing a broad range of financial products and services to a substantial and diversified client base that includes corporations, institutions and individuals. Edelweiss's products and services span multiple asset classes and consumer segments across domestic and global geographies.
The group has sizeable presence in large retail segment through its businesses such as Life Insurance, Housing Finance, Mutual Fund and Retail Financial Markets. It has an asset base of ~Rs. 55,100 Cr, over 10,000 employees across its 450 offices in India and abroad. Catering to over 1,100,000+ clients under various businesses in retail and wholesale segments.",https://www.edelweiss.in,Financial Services,"1,001-5,000 employees 1,282 on LinkedIn
            
 



    Includes members with current employer listed as Edelweiss Wealth Management, including part-time roles.","Mumbai, Maharashtra",2009,"Equity, Derivatives, Currency, Commodity, Mutual Funds, Fixed Income, IPOs, Gold ETFs, and Finance",
"SBI Card was launched in October 1998 by the State Bank of India and GE Capital. Incorporated as SBI Cards and Payment Services Limited (previously known as SBI Cards and Payment Services Private Limited), SBI Card is headquartered in Gurgaon, Haryana.

In December 2017, State Bank of India and The Carlyle Group acquired GE Capital`s stake in the Company. SBI holds 74% while Carlyle holds 26% in the SBI Card.

The aim of SBI Card is to offer Indian consumers access to a wide range of world-class, value-added payment products and services. Our endeavor is to simplify the lives of our customers, employees, and other important stakeholders.

Our innovative products and services along with our responsible corporate citizenship practices form the framework of delivering on this promise. We were awarded “Mar Tech Leadership Award” for the year 2021-22 under the category “Use of Technologies - Best Data Enablement Campaign” at MarTech Leadership Summit 2022.

Within a short span of 10 months, we achieved a credit card customer base of 1 lakh. We entered the '1 Million Card Club’ in 2002 and crossed the 2 million card base in 2005.

We are one of the leading players in the Indian credit card market, with over 14 million cards in force as of June '22, and have a presence across India.

To learn more, please visit: http://www.sbicard.com/",https://www.sbicard.com,Financial Services,"1,001-5,000 employees 11,452 on LinkedIn
            
 



    Includes members with current employer listed as SBI Card, including part-time roles.","Gurgaon, Haryana",,Credit Cards & Value-added payment products and services,
"DSP Mutual Fund is the domestic mutual funds arm of DSP Investment Managers Pvt Ltd, a leading Indian asset management firm with a 25 year old track record.

At DSP Investment Managers, we are on a quest to help a diverse set of clients #InvestForGood via a wide range of products. This includes active strategies like domestic mutual funds & funds that give you access to international opportunities via the Fund of Funds route, in addition to passive strategies such as index funds & ETFs. 

DSP Group, the family behind DSPIM, is one of the oldest financial services companies in India with a history of over 150 years. 

We hire the best people who are passionate about growth and believe in our shared values. 

For more, visit www.DSPIM.com or invest with us at www.DSPIM.com/invest. 

Mutual Fund investments are subject to market risks, read all scheme related documents carefully.",http://www.DSPIM.com,Financial Services,"201-500 employees 617 on LinkedIn
            
 



    Includes members with current employer listed as DSP Mutual Fund, including part-time roles.","Mumbai, Maharashtra",1996,"Mutual Funds, Investment Management, Asset Management, and Financial Services",
"BankBazaar.com is India’s largest fintech co-branded credit card issuer and online platform for free credit score. It has a captive base of 50Mn registered users who use the platform for free credit score tracking and in-depth personal finance content and comparison tools.

Supported by global investors such as WSV, Experian, Eight Roads, Sequoia India, Walden International and Amazon, BankBazaar has been at the forefront of democratising finance in India by providing end users with frictionless access to credit.

BankBazaar has offices in Chennai, Bangalore, and Mumbai.",http://www.bankbazaar.com,Financial Services,"1,001-5,000 employees 539 on LinkedIn
            
 



    Includes members with current employer listed as BankBazaar India, including part-time roles.","Chennai, Tamil Nadu",2008,"Personal Finance, Internet, Loans, Credit cards, and Mutual Funds",
"We at sbi securities carry the proud lineage of SBI – a brand trusted by every Indian. We offer a pool of investment products and services across various asset classes. You can choose to invest in equity, derivatives, mutual funds, corporate fixed deposits, bonds, insurance, loans and NCDs suiting your financial needs. With our newly launched trading platform, managing investments has become easier than ever.  

For more details visit us at www.sbisecurities.in",https://www.sbisecurities.in/,Financial Services,"5,001-10,000 employees 2,100 on LinkedIn
            
 



    Includes members with current employer listed as SBI Securities, including part-time roles.","Mumbai, Maharashtra",2006,"Retail Broking, Institutional Broking, Debt, Sales & Distribution, Wealth Management, stock market, mutual funds, investment, investment advisor, demat account, demat and trading account, and stock market trading","022 6854 5555
            

              Phone number is 022 6854 5555"
"PGIM, the investment management business of Prudential Financial, Inc.* is a multi-manager that delivers industry-leading strategies and solutions to clients. Each business maintains its own investment process and culture, allowing for a singular focus on delivering investment returns for clients. 

The PGIM businesses offer investors a wide range of investment strategies across asset classes and geographies, including public equities, public and private fixed income, commercial mortgages and real estate. Clients of PGIM can rely on superior long-term performance, risk management expertise and innovative products to help them realize a wide range of business objectives. 

In addition, PGIM uses its collective knowledge and business expertise to work with public, private and non-profit sector partners to create solutions that address critical social issues that have an enduring impact.

*Prudential Financial, Inc. of the United States is not affiliated in any manner with Prudential plc, incorporated in the United Kingdom or with Prudential Assurance Company, a subsidiary of M&G plc, incorporated in the United Kingdom.

Important disclosures regarding your use of this LinkedIn page can be found at → PGIM.com/Disclaimer",https://www.PGIM.com,Financial Services,"1,001-5,000 employees 3,676 on LinkedIn
            
 



    Includes members with current employer listed as PGIM, including part-time roles. Also includes employees from subsidiaries: PGIM Real Estate,PGIM Private Capital,PGIM Fixed Income and 4 more.","Newark, NJ",,"Investment Management, Fixed Income, Equities, Private Capital, Mutual Funds, ETFs, Real Estate, Quantitative, Global Investment, Institutional Investing, and Multi-asset class portfolios",
"COMPANY DESCRIPTION:
****************************************************************
Anand Rathi is a leading full service investment bank founded in 1994 offering a wide range of financial services and wealth management solutions to institutions, corporations, high–net worth individuals and families. The firm has rapidly expanded its footprint to over 350 locations across India with international presence in Dubai , Hong Kong & New York. Founded by Mr. Anand Rathi and Mr. Pradeep Gupta, the group today employs over 2,500 professionals through out India and its international offices.

The firm’s philosophy is entirely client centric, with a clear focus on providing long term value addition to clients, while maintaining the highest standards of excellence, ethics and professionalism. The entire firm activities are divided across distinct client groups: Individuals, Private Clients, Corporate and Institutions. AnandRathi has been named The Best Domestic Private Bank in India by Asiamoney in their Fifth Annual Private Banking Poll 2009. The firm has emerged a winner across all key segments in Asiamoney’s largest survey of high net worth individuals in India. 

In year 2007 Citigroup Venture Capital International joined the group as a financial partner.",https://anandrathi.com/,Financial Services,"1,001-5,000 employees 2,457 on LinkedIn
            
 



    Includes members with current employer listed as Anand Rathi Shares and Stock Brokers Ltd, including part-time roles.","Mumbai, Maharashtra",1994,"Internet Broking, Financial Services, Private Wealth Management, Investment Banking, Institutional Equities, Commodities, Mutual Funds, Currency, Investment Services, Portfolio Management, Insurance, Derivatives, IPO, and Online Trading",
"Fi is on a path to revolutionise the way the next generation of Indians handle their money. And here’s why:

👉 We believe that information is power. The Fi Money app presents you with easy to understand information on your spending, investing, and saving habits. The more you know, the better your decision making.

👉 Simplicity wins. We shave off layers of complexity using tech, design, and communication to help you get closer to your money. Your money should always be in your control.

👉 Safe, Secure, World Class. Our team comes from the who’s-who of tech companies from around the world, distilling decades worth of knowledge into a product built for Indians. Our experience exists to improve yours.

👉Join us and build for the next billion. From data-driven decision making, to high quality tech and mentorship, we believe in giving Fi-ans a fulfilling career, because it takes the best to build the best. 

Check us out at: https://fi.money/careers",https://fi.money/,Financial Services,"201-500 employees 840 on LinkedIn
            
 



    Includes members with current employer listed as Fi, including part-time roles.","Bangalore, Karnataka",2019,"Financial Services, Internet, and Tech",
"JM Financial, one of India’s prominent integrated financial services group, offers an array of services to corporations, financial institutions, high net-worth individuals and retail. 

The Group is known for its diverse businesses, it’s primary businesses include (i) Investment Bank (IB) shall cater to Institutional, Corporate, Government and Ultra High Networth clients and includes investment banking, institutional equities and research, private equity funds, fixed income, syndication and finance; (ii) Mortgage Lending includes both wholesale mortgage lending and retail mortgage lending (home loans, education institutions lending and LAP); (iii) Alternative and Distressed Credit includes the asset reconstruction business and alternative credit funds; and (iv)Asset management, Wealth management and Securities business (Platform AWS) shall provide an integrated investment platform to individual clients and includes wealth management business, broking, PMS and mutual fund business. 

Over the years, JM Financial has partnered with several leading Indian and International clients and earned their trust and confidence. JM Financial has pioneered several strategies and transactions for a wide client base spread across geographies and thus developed rich experience and expertise. Every idea is unique to the need of the client and supported by superior and timely execution to deliver maximum benefits. 

The Group is headquartered in Mumbai and has to its credit several national and international accolades for its insightful advice and execution skills.

JM Financial Group is deeply committed to investing in initiatives that improve and foster communities enabling them to sustain themselves. The Group, along with its employees, actively supports various causes related to education, healthcare, skill development, entrepreneurship promotion, disaster relief and animal welfare.",http://www.jmfl.com,Financial Services,"1,001-5,000 employees 2,375 on LinkedIn
            
 



    Includes members with current employer listed as JM Financial Ltd, including part-time roles. Also includes employees from subsidiary: JM Financial Services Ltd.","Mumbai, Maharashtra",,"Investment Banking, Investment Advisory, Institutional Securities, Asset Management, Private Equity, Real Estate Fund, Asset Reconstruction, Commodities Broking, Non Banking Financial Products, and Home Loans",
