Overview,Website,Industry,Company size,Headquarters,Founded,Specialties,Phone
"Customers turn to CSI for superior service from industry experts. We are the resource, not only for financial solutions, but for help with asset management, end of life data security, disposal and more – all on a global scale. With operations across the Americas, Europe and Asia-Pacific, we are one of the largest equipment leasing companies in the world. 

CSI has been investing in our customers'​ technology solutions for nearly five decades.",http://www.csileasing.com,Financial Services,"1,001-5,000 employees 714 on LinkedIn
            
 



    Includes members with current employer listed as CSI Leasing, Inc., including part-time roles. Also includes employees from subsidiaries: CSI EPC,CSI Leasing Europe ,Freedom Tech and 5 more.","St. Louis, MO",,"Technology Equipment Leasing, Healthcare Equipment Leasing, Media and Entertainment Equipment Leasing, Government and Education Equipment Leasing, and Equipment Disposal",
"i-exceed technology solutions is a FinTech company that powers the digital transformation of the world’s leading banks and financial institutions. Appzillon, the flagship offering from i-exceed, consists of Appzillon Digital Banking and Appzillon Digital Experience Platform. Appzillon Digital Banking is a suite of pre-built omni-channel solutions (with over 17 MM end customer downloads across the globe) that provides differentiated banking experiences for banks’ customers and staff. The Appzillon Digital Experience Platform is a low-code visual development environment that enables enterprises to realize their digital initiatives offering a best-in-class customer experience.

i-exceed works with more than 80 banks and FIs around the world including India Post Payments Bank, Canara Bank, Mashreq Bank, several tier 1 banks, regional banks, Fintechs and micro finance institutions to power rapid digital transformation. Our consumer and corporate onboarding solutions have revolutionized the onboarding experience and reduced overall end-to-end onboarding times by more than 50%. Our consumer banking, corporate banking, and sales enablement solutions helps banks streamline their user journeys, optimize process flows, and improve operational efficiencies. Appzillon’s open, scalable and micro-app based architecture enables banks to innovate and offer newer products and services faster. Learn more at www.i-exceed.com.",https://www.i-exceed.com,Financial Services,"201-500 employees 540 on LinkedIn
            
 



    Includes members with current employer listed as i-exceed , including part-time roles.","Princeton, New Jersey",2011,"Digital banking solution provider, MADP, Mobile banking solution provider , internet banking solution provider , Digital platform, Fintech , UX Design, Microapp, and low code development platform",
"Baring Private Equity Asia (BPEA) is one of Asia's largest private alternative investment firms, with $21 billion of FPAUM. BPEA manages a private equity investment program, sponsoring buyouts and providing growth capital to companies for expansion or acquisitions with a particular focus on the Asia Pacific region, as well as dedicated funds focused on private real estate and private credit. The firm has a 25-year history and over 220 employees located across 10 offices in Beijing, Delhi, Hong Kong, London, Los Angeles, Mumbai, Singapore, Shanghai, Sydney, and Tokyo. 
 
BPEA is a responsible investor that seeks to create value for all stakeholders through a sustainable approach to investing. The firm is a signatory to the UNPRI (United Nations Principles for Responsible Investment) and is committed to action within its own business and the companies in which it invests to drive sustainability across a range of issues, from climate change to social concerns to effective governance.",https://eqtgroup.com/private-capital/bpea-eqt,Investment Management,"201-500 employees 239 on LinkedIn
            
 



    Includes members with current employer listed as BPEA EQT, including part-time roles.",,1997,"Growth Equity, Leveraged Buyout, Public to Private, Education, and Business Services",
"From London to Singapore and from San Francisco to São Paulo, we help businesses enter new markets, explore new industries, and reach new milestones. We are driven by a deep-seated determination to be the best possible partner for our customers – giving you the support you need to capitalize on a world that’s changing at breakneck speed.

Our mission is to provide innovators with a convenient and simple financial interface that enables payments to flow freely and invisibly across borders. We offer a wide range of services, including payment gateway, card acquiring, business accounts, card issuing, alternative payment methods, and more.

That’s the reason why we are called Unlimint: we provide unlimited growth opportunities for our customers, freeing them from the payment constraints.

All with a single purpose: making sure you are ready for tomorrow.",http://unlimint.com/,Financial Services,"201-500 employees 279 on LinkedIn
            
 



    Includes members with current employer listed as Unlimint, including part-time roles.","London, UK",2009,"Financial services, Payment systems, Payment technologies, Payment cards, Wire transfers, Corporate solutions, Acquiring, Corporate accounts, B2B cards, Digital payments, Alternative payments, Fintech, Ecommerce, Business account, and Payments processing",
"Poonawalla Housing Finance (formerly formerly known as Magma Housing Finance) brings its legacy of Trust, Integrity, Transparency and Excellence in their financial offerings. With this commitment we aim to empower low-income sections to achieve the dream of owning a home. Understanding the needs of our customers, we provide a wide range of affordable housing solutions. 
Today, combining our digital capabilities and enhanced strength, we are dedicated to serve our valued customers with best offerings and services through our 100+ branches in 19 states.",https://poonawallahousing.com,Financial Services,"1,001-5,000 employees 605 on LinkedIn
            
 



    Includes members with current employer listed as Poonawalla Housing Finance, including part-time roles.","Pune, Maharashtra",2004,,"1800-266-3204
            

              Phone number is 1800-266-3204"
"Established in 2002 and incorporated in 2005, XL Dynamics India Pvt. Ltd. is privately held corporation providing IT, audit and quality control outsourcing solutions to a defined clientele in the US mortgage industry.

We have proven expertise to provide comprehensive solutions to a defined clientele in the US mortgage industry, including but not limited to:

• IT solutions
• Expert analysis and risk assessment audit of complex financial products
• Inspection of executed financial trades
• Documentation of policies, processes and guidelines
• Quality control services, Operations and Servicing quality control
• Trading and hedging strategy and support
• Regulatory compliance and audit services
• Securitization of loan instruments study",http://www.xldynamics.com,Financial Services,"1,001-5,000 employees 2,325 on LinkedIn
            
 



    Includes members with current employer listed as XL Dynamics India Pvt. Ltd., including part-time roles.","Navi Mumbai, Maharashtra",2005,,
"Mahindra Rural Housing Finance Limited (MRHFL), a subsidiary of Mahindra and Mahindra Financial Services Limited (MMFSL), has been established to provide Home Loans primarily in rural areas. MMFSL has been operating in Rural India for over 25 years by concentrating on financing farm equipment and vehicles for the under-banked customers. MRHFL identified a market for Home Loans designed specifically for the under served, fulfilling its mission of ""Transforming Lives""​. Since inception in April 2007, MRHFL has opened operations in 15 states namely: Maharashtra, Gujarat, Rajasthan, Madhya Pradesh, Tamil Nadu, Andhra Pradesh, Telangana, Uttar Pradesh, Uttarakhand, Odisha, Puducherry, Chattisgarh, Karnataka, Kerala and Bihar.",http://www.mahindrahomefinance.com/,Financial Services,"5,001-10,000 employees 2,297 on LinkedIn
            
 



    Includes members with current employer listed as Mahindra Home Finance, including part-time roles.","Mumbai, Maharashtra",2007,"Rural Finance, Housing Finance, Home Finance, and Rural Development","18002335333
            

              Phone number is 18002335333"
"BSE is Asia's First Exchange and World's Fastest Exchange with the Speed of 6 Microseconds.
Bombay Stock Exchange Limited is the oldest stock exchange in Asia, established in 1875. It is the first stock exchange in the country to obtain permanent recognition in 1956 from the Government of India under the Securities Contracts (Regulation) Act, 1956. It is widely recognized by its index, SENSEX.
The Exchange is professionally managed under the overall direction of the Board of Directors. The Exchange has a nation-wide reach with a presence in 417 cities and towns of India.",http://www.bseindia.com,Capital Markets,"201-500 employees 755 on LinkedIn
            
 



    Includes members with current employer listed as BSEIndia, including part-time roles.","Mumbai, Maharashtra",1875,,
"Statestreet HCL Services (India) Private Limited is a subsidiary of a Foreign Company, incorporated in 2012. It's a private unlisted company and is classified as a company limited by shares.  It has been majorly in the Business Services business for the last 10 years. The Company is registered in Delhi (Delhi) Registrar Office. Statestreet HCL Services (India) Private Limited registered address is 806, SIDDHARTH 96, NEHRU PLACE New Delhi South Delhi DL 110019 IN.",,Financial Services,"5,001-10,000 employees 4,566 on LinkedIn
            
 



    Includes members with current employer listed as State Street HCL Services Pvt Ltd, including part-time roles.","Delhi, Delhi",2012,,
"Caisse de dépôt et placement du Québec (CDPQ) is one of North America’s leading long-term institutional investors, with net assets totalling CA$365.5 billion and investments in more than 75 countries. We manage funds primarily for public and parapublic pension and insurance plans. With the highest credit ratings from DBRS, Moody’s and Standard & Poor’s, CDPQ invests in major financial markets, private equity, infrastructure and real estate, globally, in all sectors of the economy.",http://www.cdpq.com/,Investment Management,"1,001-5,000 employees 1,748 on LinkedIn
            
 



    Includes members with current employer listed as Caisse de dépôt et placement du Québec (CDPQ), including part-time roles.","Montréal, Québec",1965,,
"RapiPay is the fastest-growing assisted payment services company in the Indian fintech Industry and is a PPI Licensed holder from RBI. RapiPay operates through its Direct Business Outlets (DBOs) serving millions of Indian consumers with financial inclusion services like AEPS, Micro ATM, Domestic Money Transfer, Utility Bill Payments, Insurance etc.     

RapiPay is a subsidiary of Capital India Finance Limited (CIFL) which is a public listed company and is a leading name in NBFC.

RapiPay drives financial inclusion across the country with the help of a PAN-India network of 6 lakh+ DBOs delivering over 3 crore transactions monthly. We are proud to have served more than 10 crore unique customers so far.",https://in.rapipay.com,Financial Services,"1,001-5,000 employees 883 on LinkedIn
            
 



    Includes members with current employer listed as Rapipay Fintech Private Limited, including part-time roles.",,2018,"AEPS, Micro ATM, Payments, Fintech, Financial Inclusion, POS, Lending, Remittance, and Digital Banking","0120-6366034
            

              Phone number is 0120-6366034"
"Bharat Financial Inclusion Limited is a 100% subsidiary of IndusInd Bank Limited with presence across 21 states covering 1,20,000 villages",https://www.bfil.co.in,Financial Services,"10,001+ employees 5,220 on LinkedIn
            
 



    Includes members with current employer listed as Bharat Financial Inclusion Limited (100% subsidiary of IndusInd Bank Ltd.), including part-time roles.","Hyderabad, Telangana",1998,"Microfinance, Last Mile Connectivity, and Strong Rural Network",
The formation of Unit Trust of India marked the evolution of the Indian mutual fund industry in the year 1963. The primary objective at that time was to attract the small investors and it was made possible through the collective efforts of the Government of India and the Reserve Bank of India,http://utimf.com,Financial Services,"501-1,000 employees 1,364 on LinkedIn
            
 



    Includes members with current employer listed as UTI Mutual Fund, including part-time roles.","Mumbai, Maharashtra",,Mutual Funds,
"HDFC Mutual Fund is a Mutual Fund, which has been constituted as a trust in accordance with the provisions of the Indian Trusts Act, 1882 and is registered with SEBI. HDFC Mutual Fund offers various schemes like Equity funds, Debt funds, Liquid funds, Exchange Traded funds etc to retail and institutional investors.",https://www.hdfcfund.com,Financial Services,"1,001-5,000 employees 466 on LinkedIn
            
 



    Includes members with current employer listed as HDFC Mutual Fund, including part-time roles.","Mumbai, Maharashtra",,,
"Established In 1990, SMC is a well-diversified financial services company in India offering services across brokerage (across the asset classes of equities (cash and derivatives), commodities and currency), investment banking, wealth management, distribution of third party financial products, research, NBFC financing, depository services, insurance broking, clearing services, mortgage advisory, alternate investment fund (AIF) and real estate advisory services to corporate, institutional, high net worth individuals and other retail clients.",http://www.smcindiaonline.com,Financial Services,"1,001-5,000 employees 1,659 on LinkedIn
            
 



    Includes members with current employer listed as SMC Group, including part-time roles.","New Delhi, Delhi",1994,"Equity, Commodity & Currency trading, IPO & MF Distribution, Depository, Clearing Services, Research, Insurance Broking - Life & Non-Life, Wealth Advisory, Institutional Broking, Investment Banking, Real Estate Advisory, Mortgage Advisory, NBFC Financing, and AIF",
"Sharekhan by BNP Paribas is one of India’s largest retail broking houses. It is a subsidiary of BNP Paribas, one of the largest banking groups in the world with a net income of 7.5 Bn EUR in 2018. BNP Paribas has over 160 years of presence in India and is active in 75 countries.

Sharekhan has over 4000 employees and is present in 584 cities through 153 branches, more than 3040 business partners. The company has 19 lakh clients and on an average, executes more than 6 lakh trades per day. It was acquired by BNP Paribas in Nov’16.

Sharekhan offers a wide range of trading and investment solutions that includes equities, futures and options, commodities, currency, portfolio management services, research, mutual fund distribution and investor education.

Sharekhan has developed its leadership in full-service retail brokerage and financial services by focusing on end to end customer experience. To foster its growth, Sharekhan is reinforcing its development through its digital channels that are inherently customer-first in nature.",http://www.sharekhan.com,Financial Services,"1,001-5,000 employees 6,306 on LinkedIn
            
 



    Includes members with current employer listed as Sharekhan, including part-time roles.","Mumbai, Maharashtra",2000,,"022-25753200
            

              Phone number is 022-25753200"
"We are a housing finance company working to enable millions of Indians to fulfill their dreams of owning a bigger, better and a new home.

Our business is built on a strong foundation of people and technology who use data science and analytics to deliver world-class and affordable products and franchise for our customers. The core engine driving this balanced approach to our business is the risk management led framework at its heart.

As on July 2021, we have financially included over 22000 customers having a monthly income of USD 600, most of whom who don’t have formal access to credit from financial institutions in India due to lack of documented income.

Our award-winning proprietary technology platform PULSE, has been the game changer in helping our customers to estimate and demonstrate their undocumented income to avail credit solutions from us. PULSE has enabled a completely paperless digital experience for our customers which has helped in faster turnarounds to service them better.

We are a young team of over 1000 professionals serving 200+ locations in 13 states of India. More on us is available at www.vastuhfc.com",,Financial Services,"1,001-5,000 employees 888 on LinkedIn
            
 



    Includes members with current employer listed as Vastu Housing Finance Corporation Ltd., including part-time roles.","Mumbai, Maharashtra",2015,"Homeloan, Improvement Loan, Construction Loan, Loan Against Property, Plot Loan, and Commercial Property Loan","1800 22 0001
            

              Phone number is 1800 22 0001"
"CoinDCX is India's most valued Crypto Investment App. Our exchange is built with user experience and security in mind. We provide users single-point access to a diverse suite of crypto-based financial products and services that are backed by security processes and insurance.

We are trusted by 1.3+ crore users & have 200+ coins listed. We have solved numerous problems faced by the Indian crypto community with solutions around crypto investing, crypto trading & crypto literacy.
In simpler words, we need your expertise to up our efforts in doing what we do best.

Our proprietary aggregation model provides the highest liquidity from leading global crypto exchanges. We are an ISO certified company backed by reputed investors like Polychain Capital, Coinbase Ventures, Bain Capital Ventures, and HDR Group, operator of BitMEX.",http://coindcx.com/,Financial Services,"501-1,000 employees 619 on LinkedIn
            
 



    Includes members with current employer listed as CoinDCX, including part-time roles.","Mumbai, Maharashtra",2018,"cryptocurrency, blockchain, digital assets, cryptocurrency exchange, bitcoin, xrp, usd, usdc, usdt, eth, crytpo trading india, crypto updates, p2p, wallets, and 250+ Markets",
"KreditBee is a FinTech Platform which offers instant personal loan to professionals, where they can avail loans up to ₹3 lakhs as per their requirement. With a strong focus on online tech-based and data-centric KYC, KreditBee envisions to solve the financial inclusion gap in the varied demographic segments of the country. The platform is backed by a Systemically Important NBFC Krazybee Services Private Limited, registered with RBI since May 2017, as well as various debt & platform partners. KreditBee is a brand of Finnovation Tech Solutions Pvt Ltd and is currently a Series-C funded entity with a cumulative fundraise of over USD 200 Million. It is backed by some key VC firms and investment entities like Azim Premji’s Premji Invest, Motilal Oswal Private Equity, TPG-backed NewQuest, South Korea’s Mirae Asset Venture, and US-based Alpine Capital. Some other marquee investors include ICICI Bank, Arkam Ventures and SIDBI’s investment arm IndiaSME Investments. Also, it has various debt partners like AU Small Finance Bank, HSBC, Fullerton, and IIFL. Currently, it has 5 million loan customers, out of which over 2 million are active loan customers.",https://www.kreditbee.in,Financial Services,"1,001-5,000 employees 619 on LinkedIn
            
 



    Includes members with current employer listed as KreditBee, including part-time roles.","Bangalore, Karnataka",2018,,
"Misys and D+H join forces to create Finastra, the third largest Fintech in the world. We now have a new company page, for new updates please follow https://www.linkedin.com/company/finastra",http://www.misys.com,Financial Services,"5,001-10,000 employees 1,774 on LinkedIn
            
 



    Includes members with current employer listed as Misys, including part-time roles.","London, London",1979,"Retail Banking, Open Source Solutions, Treasury & Capital Markets, Enterprise Risk, Buy-side, Lending, Corporate Banking, Investment Management, Financial Software, Transaction Banking, and Risk Management",
"Equiniti India is an Equiniti Group company engaging in offshore business. EQ India employs highly competent professionals delivering complex and heavy transactions. EQ India services include application support/ development, software quality assurance, IT Infrastructure support services, PMO, finance shared service, marketing support and BPO process such as employee benefit solutions, shareholder services, investment services, pension solutions, central reconciliation, customer experience centre (voice process), HR & payroll. The team in India is an extended team of the respective UK and US counterparts providing successful offshore projects and meeting client SLA.

EQ India is a Centre of Excellence and Certified ISO 27001:2013 (Information Security Management System) that leverages innovation, transformation & automation to deliver contemporary solutions that proficiently cater to clients requirements. We showcase integrity and openness in our dealings with our clients. 

A key element of successful culture and business practices of the EQ India is that it incorporates similar DNA and values as the group.",http://www.equiniti-india.com,Financial Services,"501-1,000 employees 505 on LinkedIn
            
 



    Includes members with current employer listed as Equiniti India, including part-time roles.","Chennai, Tamil Nadu",2014,"IT & ITES, Finance Shared Services, HR Support Functions, Marketing & Sales Support, Complaints Management, Cyber & Financial Crime, Project Management, KYC, Customer Experience, Fintech, Contact Centre, BPO Services, customer experience centre, Financial Services, Creative Services, International Payments, Pensions, and Loans Technology","+91 44 42889800
            

              Phone number is +91 44 42889800"
"Credgenics is an innovative FinTech which provides advanced loan collections and debt recovery technology solutions to Banks, Non-banking finance companies, ARCs and Digital lending firms worldwide. The award-winning SaaS based platform covers end-to-end collections lifecycle with unique capabilities including multi-channel digital communications, AI powered predictor models for optimal collections strategy, field collections mobile app CG Collect, Billzy digital payments, legal management system, comprehensive dashboards and deep analytical models. Credgenics platform helps lenders leverage technology to boost their resolution rates, improve collections efficiencies, increase collections, transform customer experience and reduce non performing loans.",https://credgenics.com/,Financial Services,"201-500 employees 290 on LinkedIn
            
 



    Includes members with current employer listed as Credgenics, including part-time roles.","Noida, Delhi",,"SaaS, NPA Resolution, Fintech, Loan Collections, Debt Recoveries, Banking Technology, Digital Collections, Technology Solutions, Credit Recoveries, Mobile Collections, Loan Repayments, and Digital Banking",
"When you invest with intelligence, life opens up a wealth of choices. ET Money helps you amplify the power of investing intelligence by personalizing it for you & your life goals. So that you can choose to live a life that's full of choices.
Live your choices with ET Money.",http://www.etmoney.com,Financial Services,"201-500 employees 181 on LinkedIn
            
 



    Includes members with current employer listed as ET Money, including part-time roles.","Gurugram, Haryana",2015,,
"We are committed to lowering costs, improving quality and delivering faster results for our clients. Our insights, software robotics and workforce solutions drive the day-to-day activity so our clients can focus on growing their business.

Using a lean Six Sigma approach, our team reviews client processes, eliminates non-value adds, and streamlines productivity. We build and share financial and legal technology to automate and optimize workforce performance. We recruit, train and manage highly-skilled human resources to meet project-based or full-time staffing needs.

Our clients have access to a global team of subject matter experts specializing in data/analytics, operations automation, loan administration and legal support. We serve a variety of industries including banking, automotive finance, credit card, mortgage, insurance and telecommunications.",http://www.aisinfo.com,Financial Services,"501-1,000 employees 544 on LinkedIn
            
 



    Includes members with current employer listed as AIS InfoSource, including part-time roles.","Houston, Texas",2000,"Business Transformation, Robotics with Artificial Intelligence, Process Engineering, Automation, Data & Predictive Analytics, Operations, Loan Administration, Financial Services, Technology & Digital, IT Infrastructure , Application Development, Default Servicing, Bankruptcy, Litigation Support, Staffing, Workforce Optimization, Banking, Auto Finance, Mortgage Servicing, Insurance, and Telecommunications","713-395-9500
            

              Phone number is 713-395-9500"
